{
  "verdict": "PROCEED",
  "steelman": "After the round-1 loop-back, the design closes its one real robustness gap: ADR-008 adds a transactional outbox per producing service plus idempotent order.create/capture retry, so the dual-write window from RT-2 is eliminated and the sync-orchestration choice (ADR-007) is now crash-safe, with the reservation TTL as a backstop. All S1 correctness invariants remain satisfied, contracts are complete and consumable, and the remaining items are tracked, owned, and non-blocking for the backend fan-out. The plan is safe to fan out to per-component work (S3 contracts, S4a backend), with frontend explicitly gated on UX maturity.",
  "findings": [
    { "id": "RT-1", "severity": "low", "category": "architecture", "claim": "No standalone Orchestrator for the checkout journey (sync orchestration in checkout-service).", "evidence": "ADR-007 (accepted MVP deviation); architecture_smells fail → resolution adr; now crash-safe via ADR-008.", "recommendation": "Accepted for the single-journey MVP; revisit and promote to a real Orchestrator when a second cross-context journey appears." },
    { "id": "RT-3", "severity": "low", "category": "operability", "claim": "Numeric SLO thresholds still TBD.", "evidence": "observability-spec TBD; now tracked as OQ-3 with PM+TL owner.", "recommendation": "Wire latency alerts once PM supplies numbers; does not block build start." },
    { "id": "RT-4", "severity": "low", "category": "requirements", "claim": "S1.5 UX maturity 1 feeds frontend-implement.", "evidence": "S1.5 output maturity 1; carried in S2 coverage_gaps.", "recommendation": "Gate S4b frontend-implement on UX maturity ≥ 2; S3/S4a backend proceed now." },
    { "id": "RT-5", "severity": "low", "category": "contract", "claim": "Catalog/cart routes lack BA stories/contracts.", "evidence": "S2 coverage_gaps ux_route_without_ba_story.", "recommendation": "BA to confirm browse/cart scope; flag for QA coverage. Non-blocking for the specified stories." }
  ],
  "bias_checks": [
    "Steelman written before findings.",
    "Heterogeneity: author_model == critic_model (Opus 4.8) — confidence capped; a cross-model (Codex gpt-5.5 / Gemini) re-review is recommended before the human L3 sign-off.",
    "Verified RT-2 is genuinely resolved (not merely renamed): ADR-008 commits the event in the same DB transaction and makes order.create idempotent on confirm_id — this removes the atomicity gap, not just documents it.",
    "Resisted approval-momentum bias: re-checked that the remaining lows are owned/tracked, not silently dropped."
  ],
  "confidence": 0.75,
  "audit_id": "c9f5a1b3-7d46-4e82-9038-2b0c4d6f8e15"
}
